{
  "requestId": "req_A0001",
  "locale": "tr-TR",
  "profileId": "kid_demo",
  "child": {
    "name": "İrem",
    "ageBand": "8-10"
  },
  "worldId": "uzay_macerasi",
  "length": "orta",
  "tone": "neseli",
  "mode": "normal",
  "characters": [
    {
      "id": "chr_pamuk",
      "name": "Pamuk",
      "kind": "köpek",
      "traits": [
        "meşgul",
        "sadık"
      ]
    }
  ],
  "wish": "Masalda bir ejderha dostum olsun",
  "series": null,
  "parentSettings": {
    "freeText": "on",
    "fearLevel": "mild",
    "avoidTopics": [
      "olum_kayip"
    ]
  },
  "includeImagePrompts": true
}